" More likely, changes in video game music creation will have very little to do with technology and more to do with other factors of game development as a business whole",['as']
" As sales of video game music diverged from the game itself in the West (compared to Japan where game music CDs had been selling for years), business elements also wield a new level of influence",['also', 'as']
" Music from outside the game developer's immediate employment, such as music composers and pop artists, have been contracted to produce game music just as they would for a theatrical movie",['as', 'just as']
" Many other factors have growing influence, such as editing for content, politics on some level of the development, and executive input",['as']
" This means that if the music of a game is not impactful enough, the game may not sell well, regardless of how extraordinary the gameplay itself is",['if', 'that', 'regardless']
" A few of which include a faster paced tempo, a higher treble line, as well as a more powerful bass",['as well']
" Since action games are based on quick thinking and spontaneous reactions, the result is more exciting gameplay",['since']
" The purpose of music in such games is to enhance the experience, calm the player, or simply serve as a catchy tune",['as', 'simply']
" While music doesn't play in the background of our real lives, the music is composed in such a way that is still reminiscent of whatever scenery is portrayed in the game",['while', 'still', 'that is']
"
As video game music sets the mood for the background of video games, sound effects are the ones to amplify the actions within the game, therefore, making it a vital part of video game music",['as', 'therefore']
" Sound effects help make a virtual scene, a reality by helping the player respond to the natural sounds he or she would hear if it were in real life",['if']
" Usually, video games with great audio do better in the market due how well it engages the player while they play and encourage them to continue to game more",['while']
" The more sound effects the creators put, the more successful the game will be",['(T|t)(he more).+?(the more)']
"
Sound effects have the power to manipulate the environment for the player in an almost tangible way where they believe they are actually in the game",['actually']
" These are essentials in making it more realistic, since each little sound effect helps create a more realism within virtuality",['since']
" As the speed of the aliens approaching the player begin to increase, so did the speed of the music it played as well",['as', 'as well']
" As technology has intelligently skyrocketed, it has taken sound effects into a whole new dimension making video games more addicting as ever",['as']
"
Along with sound effects in video game music, soundtracks as well play a huge part in manipulating the mood, heightening the player's emotions, and making the virtual world more present within the game",['as', 'as well']
" However, this study shows how video game soundtracks also have the power to not only help the gamer focus on playing the video game but also collect their thoughts and help with their cognitive skills",['also', 'but', 'not only']
" After this study was published by Jiulin Zhang and Xiaoqing Fu from the School of Psychology at Southwest University in China, many video game designers began to give importance to the soundtracks that were playing in video games as a marketing strategy to increase the amount of sales that could be done if people begin to realize the direct link between video game music soundtracks and immersion",['if']
" Since video game music soundtracks have the power to raise cognitive power, its importance in getting gamers to be addicted to the newest games that are being released have heightened as well",['since', 'as well']
" These soundtracks can not only create a more vivid and exhilarating gaming experience, but they can also help the mind in other ways by raising cognitive motor skills",['also', 'but', 'not only']
" While a game may be able to get by without music or dialogue, one without sound effects will be very disappointing",['while']
"  Video game music is meant to have a memorable effect, such as Super Mario Land from 1989 on the GameBoy",['as']
" Practically everyone knows the classic Mario background music because the tune is catchy and memorable, bring gamers to keep coming and buying the newest edition of Mario games for nostalgia reasons",['because']
" Despite the common knowledge of video game composers and their importance on video games, they still have a major impact on video games",['still']
" In arcades, it was the music that first attracted people towards the games, enticing people to play",['first']
" (August 2014) (Learn how and when to remove this template message)
                                                                                                                                                                                                                                                                     
Many games for the Nintendo Entertainment System and other early game consoles feature a similar style of musical composition that is sometimes described as the "video game genre",['that is', 'as']
" The genre's compositional elements largely developed due to technological restraints, while also being influenced by electronic music bands, particularly Yellow Magic Orchestra (YMO), who were popular during the late 1970s to 1980s",['while', 'also']
"
Although the tones featured in NES music can be thought of emulating a traditional four-piece rock band (triangle wave used as a bass, two pulse waves analogous to two guitars, and a white noise channel used for drums), composers would often go out of their way to compose complex and rapid sequences of notes, in part due to the restrictions mentioned above",['although', 'as']
" This is similar to music composition during the Baroque period, when composers, particularly when creating solo pieces, focused on musical embellishments to compensate for instruments such as the harpsichord that do not allow for expressive dynamics",['as']
" For the same reason, many early compositions also feature a distinct jazz influence",['also']
" These would overlap with later influences from heavy metal and j-pop music, resulting in an equally distinct compositional style in the 16-bit era",['equally']
"
In an unrelated but parallel course in the European and North American developer scene, similar limitations were driving the musical style of home computer games",['but']
" Module file format music, particularly MOD, used similar techniques but was more heavily influenced from the electronic music scene as it developed, and resulted in another very distinct subgenre",['more + [a-z]*ly', 'but']
" Demos and the developing demoscene played a big part in the early years, and still influence video game music today",['still']
"
As technological limitations gradually lifted, composers were given more freedom and with the advent of CD-ROM pre-recorded soundtracks came to dominate, resulting in a noticeable shift in composition and voicing style",['as']
" Since the audio was not reliant on a sound-card's synthesis, CD-ROM technology ensured that composers and sound designers could know what audio would sound like on most consumer configurations and could also record sound effects, live instruments, vocals, and in-game dialogue",['since', 'that', 'also']
"
As the divisions between movies and video games has blurred, so have divisions between film scores and video game scores",['as']
"
Selling video game soundtracks separately as CDs has become increasingly popular in the industry",['as']
" Interpretive albums, remixes, and live performance albums were also common variations to original soundtracks (OSTs)",['also']
" Therefore, interested non-Japanese gamers had to import the soundtracks and/or sheet music books through on or offline firms specifically dedicated to video game soundtrack imports",['therefore']
" This has been somewhat less of an issue more recently as domestic publishers of anime and video games have been producing western equivalent versions of the OSTs for sale in UK and US, though these are often for more popular titles",['more + [a-z]*ly', 'though']
" Commonly, games are being used to promote and sell licensed music, rather than just original score, and recording artists are being used to market and sell games",['rather than']
" Some game soundtracks have become so popular they have reached platinum status, such as NBA Live 2003",['as']
" In 1991, he also formed a series called Orchestral Game Music Concerts, notable for featuring other talented game composers such as Yoko Kanno (Nobunaga's Ambition, Romance of the Three Kingdoms, Uncharted Waters), Nobuo Uematsu (Final Fantasy), Keiichi Suzuki (Mother/Earthbound), and Kentaro Haneda (Wizardry)",['also', 'as']
" On August 20, 2003, music written for video games such as Final Fantasy and The Legend of Zelda was performed for the first time outside Japan, by the Czech National Symphony Orchestra in a Symphonic Game Music Concert in Leipzig, Germany at the Gewandhaus concert hall",['as']
" Nobuo Uematsu has also performed a variety of Final Fantasy compositions live with his rock band, The Black Mages",['also']
"
On July 6, 2005, the Los Angeles Philharmonic Orchestra also held a Video Games Live concert at the Hollywood Bowl, an event founded by video game music composers Tommy Tallarico and Jack Wall",['also']
" It also incorporated real-time video feeds that were in sync with the music, as well as laser and light special effects",['also', 'as', 'as well']
" Media outside the video game industry, such as NPR and The New York Times, have covered their subsequent world tours",['as']
" Whilst Eminence had performed video game music as part of their concerts since their inception, the 2007 concert marked the first time ever that the entire setlist was pieces from video games",['that', 'as']
" Former YMO member Haruomi Hosono also released a 1984 album produced entirely from Namco arcade game samples entitled Video Game Music, an early example of a chiptune record and the first video game music album",['also']
" Other post-secondary schools have more games-focused programs, such as DigiPen Institute of Technology, Columbia College Chicago, and Academy of Art University, who all offer programs in Music and Sound Design",['as']
"
More informal institutions, like the training seminars at GameSoundCon also feature classes in how to compose video game music",['also']
"
Extracurricular organizations devoted to the performance of video game music have also been implemented in tandem with these new curriculum programs",['also']
" The group was founded by Kamp, Summers and Sweeney in August 2011, who have also edited a collection of essays based around the study of game sound entitled Ludomusicology: Approaches to Video Game Music, published in July 2016",['also']
" Whereas Kamp, Summers and Sweeney have a background in musicology, Fritsch's background is in performance studies",['whereas']
" As the market has expanded, so have the types of jobs in game music",['as']
" Most bigger budget games such as Call of Duty, Mass Effect, Ghost Recon, or Lost Planet hire composers in this fashion",['as']
" Original score and soundtrack may require the hiring of a Music Director, who will help create the game music as well as help book the resources needed for performing and recording the music",['as', 'as well']
" Game composers, particularly for smaller games, are likely to provide other services such as sound design (76% of game composers also do some sound design), integration (47% of game composers also integrate their music into audio middleware), or even computer coding or scripting (15%)",['also', 'as']
"
With the rising use of licensed popular music in video games, job opportunities in game music has also come to include the role of a music supervisor",['also']
" A music supervisor is needed to not only help select music that will suit the game, but to also ensure the music is fully licensed in order to avoid lawsuits or conflicts",['in order to', 'also', 'but', 'not only']
" Music supervisors may also help negotiate payment, which for artists and songwriters is often a one-time buy out fee, because games do not generate music royalties when they are sold",['also', 'because']
" A growing trend is to contract artists to write original songs for games, to add to their value and exclusivity, and once again supervisors can be a part of that process",['once again']
"
Since the mid-2000s, video game music has been recognized in a number of award shows, though some categories have been short-lived",['though']
" The song won for its placement on Christopher Tin’s album Calling All Dawns, but had been used in the game six years prior",['but']
"
In 2012, the Grammy Awards included video game music as part of its Visual Media Awards, expanding the category to include Motion, Television, Video Game Music, or Other Visual Media",['as']
"
Fans also make their own song remixes and compilations, and have built online remixing communities through the ease of internet distribution",['also']
"
Japanese dōjin music scene is notable for producing albums of arranged videogame music which derived from popular retro franchises such as Mega Man, Chrono Trigger or Final Fantasy, from dōjin games, such as Touhou Project, studio Key visual novels and When They Cry series, from popular franchises on Comiket, such as Type-Moon Fate series or Kantai Collection",['as']
" Video game addiction may present itself as compulsive gaming, social isolation, mood swings, diminished imagination, and hyper-focus on in-game achievements, to the exclusion of other events in life",['as']
"
In May 2013, the American Psychiatric Association (APA) declined to include video game addiction in the 5th edition of the Diagnostic and Statistical Manual of Mental Disorders, concluding that there was insufficient evidence to include it as an official mental disorder",['that']
"
While Internet gaming disorder is proposed as a disorder, it's unclear how much this disorder is caused by the gaming activity itself, or whether it is to some extent an effect of other disorders",['while', 'as']
" For example, while some research has linked violent video games with increased aggressive behavior other research has failed to find evidence for such links",['while', 'for example']
" The anticipation of such rewards can create a neurological reaction that releases dopamine into the body, so that once the reward is obtained, the person will remember it as a pleasurable feeling",['so', 'so that']
" In reference to gamers, such as one suicide in China, the head of one software association stated, "In the hypothetical world created by such games, they become confident and gain satisfaction, which they cannot get in the real world",['as']
"
Ferguson, Coulson and Barnett in a meta-analytic review of the research, concluded that the evidence suggests that video game addiction arises out of other mental health problems, rather than causing them",['that', 'rather than']
" According to lead investigator Richard Ryan, they believe that players play for more reasons than fun alone",['that']
" Ryan, a motivational psychologist at Rochester, says that many video games satisfy basic psychological needs, and players often continue to play because of rewards, freedom, and a connection to other players",['that', 'because']
" Two or more children see her each week because of excessive computer and video game play, and she treats their problems as she would any addiction",['because', 'as']
" Video game addiction is a broader concept than internet gaming addiction, but most video game addiction is associated with Internet gaming",['but']
" Because of the distinguishing features and increased risks of clinically significant problems associated with gaming in particular, the Workgroup recommended the inclusion of only internet gaming disorder in Section 3 of the DSM-5",['because']
"
APA has developed 9 criteria for characterizing the proposed Internet gaming disorder:
One of the most commonly used instruments for the measurement of addiction, the PVP Questionnaire (Problem Video Game Playing Questionnaire), was presented as a quantitative measure, not as a diagnostic tool",['most + [a-z]*ly']
" But, APA's 9 criteria for diagnosing Internet gaming disorder were made by taking point of departure in 8 different diagnostic/measuring tools proposed in other studies",['but']
" A group of 26 scholars wrote an open letter to the WHO, suggesting that the proposed diagnostic categories lacked scientific merit and were likely to do more harm than good",['that']
" A report, prepared by mental health experts at Oxford University, Johns Hopkins University, Stockholm University and the University of Sydney, sponsored by The Association for UK Interactive Entertainment, and supported by 22 video game industry trade organizations including the Entertainment Software Association of the United States and Interactive Software Federation of Europe, asserts that while there may be potential addiction associated with video gaming, it is premature to consider it a disorder without further study, given the stigmatization that video games are perceived as, and request WHO use caution when finalizing the ICD draft",['while', 'that', 'further']
" Vladimir Poznyak, the coordinator for the WHO Department of Mental Health and Substance Abuse, defended the addition of gaming disorder, believing the backlash against the addition as a moral panic as they chose a very narrow definition that defines only the most extreme cases of gaming disorder",['against']
" Poznyak asserts that several medical professionals consulting on the ICD-11 did believe gaming disorder to be real, and by including it in the ICD-11, there can now be earnest efforts to define its causes and symptoms betters and methods to deal with it, and now include the video game industry within the conversation to help reduce the effects of video games on public health",['that']
"
As a growing concern of video game addiction the use of psychopharmacology, psychotherapy, twelve-step programs, and use of continuing developing treatment enhancements have proven to show signs of the decrease the side effect of the addiction of video games",['as']
"[
Some countries, such as South Korea, China, the Netherlands, Canada, and the United States, have responded to the perceived threat of video game addiction by opening treatment centers",['as']
" Along with a number of programs designed to help those struggling with addiction, Game Quitters also advocates following a 90-day-detox from gaming, providing free support through an active online forum allowing users to share their journey into overcoming video game addiction",['also']
" Most of the addiction “boot camps” in China are actually illegal treatment centers, but have remained popular despite growing controversy over their practices",['actually', 'but']
" Keith Bakker, founder and former head of the clinic, has stated that 90% of the young people who seek treatment for compulsive computer gaming are not addicted",['that']
"
The National Health Service is opening a treatment centre, run by the Central and North West London NHS foundation trust, that will initially focus on gaming disorder but plans to expand to cover other internet-based addictions",['but']
"
The Cabin Chiang Mai is a rehabilitation clinic facility in Chiang Mai that offers treatment services for a wide range of addictions such as alcohol, drug and more recently gaming addiction",['more + [a-z]*ly', 'as']
"
A report by the Council on Science and Public Health to the AMA cited a 2005 Entertainment Software Association survey of computer game players and noted that players of MMORPGs were more likely to play for more than two hours per day than other gamers",['that']
"
In a 2005 Tom's Games interview, Maressa Orzack estimated that 40% of the players of World of Warcraft (an MMORPG) were addicted, but she did not indicate a source for the estimate",['that', 'but']
"
A 2006 lecture reported by the BBC indicated that 12% of polled online gamers reported at least some addictive behaviours",['that']
" The lecturer, Professor Mark Griffiths of Nottingham Trent University, stated in another BBC interview that addicts are "few and far between",['that']
" Further, the average play time varied by age and gender, from eight hours per week (responses from teen girls) to 14 hours per week (responses by teen boys)",['further']
" However, the study was further criticized in eLetters to the same journal for failing to use well-validated measures of attention problems or control for other important variables",['further']
" Also, a study in Pediatrics found problematic gaming behaviors to be far less common, about 4%, and concluded that such problems were the result of underlying mental health problems rather than anything unique to gaming",['that', 'also', 'rather than']
"
Writing in the Review of General Psychology's special issue on video games, Barnett and Coulson expressed concern that much of the debate on the issue of addiction may be a knee jerk response stimulated by poor understanding of games and game players",['that']
" Such issues may lead both society and scholars to exaggerate the prevalence and nature of problematic gaming, and over-focus on games specifically while ignoring underlying mental health issues",['while']
"
Other scholars have cautioned that comparing the symptoms of problematic gaming with problematic gambling is flawed, and that such comparisons may introduce research artifacts and artificially inflate prevalence estimates",['that']
" For instance, Richard Wood has observed that behaviors which are problematic in regards to gambling may not be as problematic when put into the context of other behaviors that are rewarding such as gaming",['that', 'for instance']
" Similarly, Barnett and Coulson have cautioned that discussions of problematic gaming have moved forward prematurely without proper understanding of the symptoms, proper assessment and consequences",['that']
"
Some scholars suggest that psycho-social dependence may revolve around the intermittent reinforcements in the game and the need to belong",['that']
"
Many[who?] describe video game addiction to be a global mental health problem and that gamers who gain characteristics of addiction show decreased functioning in school, social, family, occupational and social domains of their lives in addition to their social lives",['that']
" Griffiths, which dived deeper into the source of gaming addiction, one interviewer described gaming as a method of stress relief",['as']
" Another person described gaming as a medicine "it was a medicine for me",['as']
"
In July 2018, a study published by LSU's Pennington Biomedical Research Center shows that some video games can decrease or control obesity, lower the blood pressure and cholesterol in children if followed with proper coaching and a step tracker",['if', 'that']
"
Though the study on the topic of gaming addiction is growing, the research is still young, and is therefore conducive to critique",['still', 'therefore', 'though']
" Many rely on self-surveys from University students and also lack time frames making it difficult to study the impact, if any, of addiction on a long term scale",['also']
" Other concerns also address the definition of addiction and how to measure it, questioning whether or not time is a proper unit to determine how addicted someone is to gaming",['also']
" A 2014 study done by Brunborg, Mentzoni and Froyland found that video game addiction does have a correlation with negative outcomes, such as depression",['that', 'as']
" However, as stated in the article, the link between time spent on gaming and the same outcomes were found to be weaker than the former, showing that time may not be the only factor in gaming addiction",['as']
"
Though the critiques are present, studies on this topic are still relatively young and growing and there is much to still be explored in this realm",['still', 'though']
"
The study shows that people with gaming addiction are more exposed to all the tested health factors than the other groups",['that']
"
Press reports have noted that some Finnish Defence Forces conscripts were not mature enough to meet the demands of military life and were required to interrupt or postpone military service for a year",['that']
"
In a July 2007 article, Perth, Western Australia, parents stated that their 15-year-old son had abandoned all other activities to play RuneScape, a popular MMORPG",['that']
"
In an April 2008 article, The Daily Telegraph reported that surveys of 391 players of Asheron's Call showed that 3% of the respondents suffered from agitation when they were unable to play, or missed sleep or meals to play",['that']
" The article reports that University of Bolton lead researcher John Charlton stated, "Our research supports the idea that people who are heavily involved in game playing may be nearer to autistic spectrum disorders than people who have no interest in gaming",['that']
"
According to ABC News, parents have many concerns about their children playing video games, such as:
Other concerns are addiction, safety concerns and violence, aggression and misbehavior",['as']
" In 2006, it relaxed the rule so only citizens under the age of 18 would face the limitations",['so']
"
In 2011, the South Korean government implemented a law, known as the Shutdown Law or the Cinderella Law, which prohibits children under the age of 16 from playing online video games between the hours of 12 am to 6 am",['as']
