" It was also the first game to confront the player with waves of targets that would shoot back at the player and the first to include background music during game play, a simple four-note loop",['also']
" With its intense game play and competitive scoring features, Space Invaders became a national phenomenon as over 200,000 invader games—counting clones and knockoffs—entered Japanese game centers by the middle of 1979",['as']
" While not quite as popular in the United States, Space Invaders became the biggest hit the industry had seen since the Great Depression as Midway, serving as the North American manufacturer, moved over 60,000 cabinets",['as']
" The one-two punch of Space Invaders and the Atari game Asteroids (1979), which moved 70,000 units and popularized the recording of multiple high scores in a table, resulted in video arcade games completely displacing pinball and other amusements to become the central attraction of not just the shopping mall arcade, but also a variety of street locations from convenience stores to bowling alleys to pizza parlors",['also', 'but']
" Many of the best-selling games of 1980 and 1981 such as Galaxian (1979), Defender (1980), Missile Command (1980), Tempest (1981), and Galaga (1981) focused on shooting mechanics and achieving high scores",['as']
" Starting with Pac Man in 1980, which sold 96,000 units in the United States, a new wave of games appeared that focused on identifiable characters and alternate mechanics such as navigating a maze or traversing a series of platforms",['as']
" As Pac Man ignited an even larger video game craze and attracted more female players to arcades, revenues jumped again to $4",['as']
" Meanwhile, the number of arcades—defined as any location with ten or more games—more than doubled between July 1981 and July 1983 from over 10,000 to just over 25,000",['as', 'meanwhile']
" Fairchild semiconductor struck first in this market with the Channel F, but after losing millions in the digital watch business, the company took a conservative approach to the programmable console market and kept production runs of the system low",['first', 'but']
" As a result, by the end of 1977, Fairchild had only sold about 250,000 systems",['as a result', 'as']
" Magnavox joined the programmable market in 1978 with the Odyssey2, while toy company Mattel released the Intellivision in 1979, which featured graphics superior to any of its competitors",['while']
"
After both Atari and Fairchild made a strong showing in 1977, the market hit a difficult patch in 1978 when retailers resisted building inventory, believing that the newly emerging electronic handheld market would displace video games",['that']
" Atari, for example, manufactured 800,000 systems, but proved unable to sell more than 500,000 to retail",['but', 'for example']
" New Atari CEO Ray Kassar subsequently harnessed his company's leftover stock to help transform video game consoles into a year-round product rather than something just purchased by retailers for sale during the holiday season",['rather than']
" Buoyed by the success of the game, Atari's consumer sales almost doubled from $119 million to nearly $204 million in 1980 and then exploded to over $841 million in 1981, while sales across the entire video game industry in the United States rose from $185",['while']
" Mattel settled into second place with roughly 15%-20% of the market, while Magnavox ran a distant third, and Fairchild exited the market entirely in 1979",['while']
" The company went on to develop a string of hits including Kaboom! (1981), River Raid (1982), and Pitfall! (1982), recognized as one of the foundational games of the scrolling platformer genre",['as']
"
In 1982, Atari released a more advanced console based on its 8-bit computer line, the Atari 5200, which failed to perform as well as its predecessor",['as well']
"
While the fruit of retail development in early video games appeared mainly in video arcades and home consoles, home computers began appearing in the late 1970s and were rapidly evolving in the 1980s, allowing their owners to program simple games",['while']
" Soon many of these games—at first clones of mainframe classics such as Star Trek, and then later ports or clones of popular arcade games such as Space Invaders, Frogger, Pac-Man (see Pac-Man clones) and Donkey Kong—were being distributed through a variety of channels, such as printing the game's source code in books (such as David Ahl's BASIC Computer Games), magazines (Creative Computing), and newsletters, which allowed users to type in the code for themselves",['at first']
"
Games were also distributed by the physical mailing and selling of floppy disks, cassette tapes, and ROM cartridges",['also']
"
The video games industry experienced its first major growing pains in the early 1980s as publishing houses appeared, with many businesses surviving 20+ years, such as Electronic Arts—alongside fly-by-night operations that cheated the games' developers",['as']
" While some early 1980s games were simple clones of existing arcade titles, the relatively low publishing costs for personal computer games allowed for bold, unique games",['while']
"
The Sinclair, Acorn and Amstrad offerings were generally only known in Europe and Africa, the NEC and Sharp offerings were generally only known in Asia, and the MSX had a base in South America, Europe, Middle East and Asia, while the US-based Apple, Commodore and Atari offerings were sold in both the US and Europe",['while']
" By that year the computer gaming market took over from the console market following the crash of that year; computers offered equal gaming ability and, since their simple design allowed games to take complete command of the hardware after power-on, they were nearly as simple to start playing with as consoles",['since']
" It found initial success because it was marketed and priced aggressively",['because']
" It also used the same game controller ports popularized by the Atari 2600, allowing gamers to use their old joysticks with the system",['also']
"
In 2008 Sid Meier listed the IBM PC as one of the three most important innovations in the history of video games",['as']
" The primitive CGA graphics of prior models, with only 4-color 320×200 pixel graphics (or, using special programming, 16-color 160×100 graphics) had limited the PC's appeal to the business segment, as its graphics failed to compete with the C64 or Apple II",['as']
" However, the sound abilities of the AT were still limited to the PC speaker, which was substandard compared to the built-in sound chips used in many home computers",['still']
" Also, the relatively high cost of the PC compatible systems severely limited their popularity in gaming",['also']
"
The Apple Macintosh also arrived at this time",['also']
" It lacked the color abilities of the earlier Apple II, instead preferring a much higher pixel resolution, but the operating system support for the graphical user interface (GUI) attracted developers of some games (e",['but', 'instead']
" This was a big jump ahead of most 8-bit home computers but still lagged behind platforms with built-in sound and graphics hardware like the Amiga",['still', 'but']
" Thus while both the ST and Amiga were host to many technically excellent games, their time of prominence was shorter than that of the 8-bit machines, which saw new ports well into the 1980s and even the 1990s",['while']
" This would last until the introduction of Creative Labs' Sound Blaster in 1989, which took the chip and added new features while remaining compatible with Ad Lib cards, and creating a new de facto standard",['while']
" However, many games would still support these and rarer things like the Roland MT-32 and Disney Sound Source into the early 1990s",['still']
"
Shareware gaming first appeared in the mid-1980s, but its big successes came in the 1990s",['first', 'but']
" Snipes is officially credited as being the original inspiration for NetWare",['as']
" Other services such as Kahn, TEN, Mplayer, and Heat",['as']
" These services ultimately became obsolete when game producers began including their own online software such as Battle",['as']
"
The first user interfaces were plain-text—similar to BBSs— but they operated on large mainframe computers, permitting larger numbers of users to be online at once",['but']
" Popular text-based services included CompuServe, The Source, and GEnie, while platform-specific graphical services included PlayNET and Quantum Link for the Commodore 64, AppleLink for the Apple II and Macintosh, and PC Link for the IBM PC—all of which were run by the company which eventually became America Online—and a competing service, Prodigy",['while', 'eventually']
" Interactive games were a feature of these services, though until 1987 they used text-based displays, not graphics",['though']
" While the handheld received modest success in the first year of production, the lack of games, screen size and video game crash of 1983 brought about the system's quick demise",['while']
" Improving LCD technology meant the new handhelds could be more reliable and consume fewer batteries than LED or VFD games, most only needing watch batteries",['most + [a-z]*ly']
" They could also be made much smaller than most LED handhelds, even small enough to wear on one's wrist like a watch",['also']
" Tiger Electronics borrowed this concept of videogaming with cheap, affordable handhelds and still produces games in this model to the present day",['still']
"
At the end of 1983, several factors, including a market flooded with poor-quality games, the commercial failure of several important Atari 2600 titles, and home computers emerging as a new and more advanced gaming platform, caused the industry to experience a severe downturn",['as']
"
As a result of the crash, a globally important video gaming industry emerged in Japan, creating important room for companies like Nintendo and Sega",['as a result', 'as']
"
Whilst a broken gaming industry in the US took several local businesses to bankruptcy and practically ended retail interest in video gaming products, an 8-bit third generation of video game consoles started in Japan as early as 1983 with the release of both Nintendo's Family Computer ("Famicom") and Sega's SG-1000 on July 15",['as']
" The first clearly trumped the second in terms of commercial success in the country, causing Sega to replace it, two years later, by a severely improved and modernized version called the Sega Mark III",['clearly']
"[citation needed]
In efforts to make the Famicom marketable in the US, Nintendo created a completely redesigned version of it, called the Nintendo Entertainment System (NES), to be sold in the country as a product unrelated to video gaming",['as']
" For this same reason, the company also developed a toy robot accessory called the R",['also']
" The console was later released in other Western countries, but because of heavy competition from home computers such as the ZX Spectrum, Amstrad CPC and Commodore 64, and a lack of marketing, the NES was prevented from having as much success in Europe",['because', 'but']
" While Sega focused on unique gameplay experiences and innovative technology (with Master System's superior technical properties which allowed better graphics, and accessories like LCD glasses), Nintendo focused on creating long and popular game franchises which often repeated the same features",['while']
"91 million worldwide copies, against 14",['against']
"
In this generation, the gamepad or joypad, took over for joysticks, paddles, and keypads as the default game controller",['as']
" This generation also marked a shift in the dominance of home video game console hardware and console game production from the United States to Japan",['also']
"
The third console generation marked the debut of various high-profile role-playing franchises, such as The Legend of Zelda, Dragon Quest, Phantasy Star and Final Fantasy, the latter of which financially saved Japanese developer Square",['as']
"
By 1989 the market for cartridge-based console games was more than $2 billion, while that for disk-based computer games was less than $300 million",['while', 'that']
" Large computer-game companies such as Epyx, Electronic Arts, and LucasArts began devoting much or all of their attention on console games",['as']
" Even though it was technically superior to the Master System and Nintendo Entertainment System, it was discontinued after 6 months",['even though', 'though']
" The TurboGrafx-16, named the PC Engine in Europe and Japan, debuted in 1987 as the first commercial 16-bit game system",['as']
" It had a large following in Japan, but, did poorly in North America and Europe because of its limited library of games and because of excessive distribution restrictions imposed by Hudson Soft",['because', 'but']
" The TurboGrafx-16 was billed as the first 16-bit system but its central processor was an 8-bit HuC6280, with only its HuC6270 graphics processor being a true 16-bit chip",['but']
" Also, the much earlier Mattel Intellivision contained a 16-bit processor",['also']
"
In Japan, the PC Engine was a very successful competitor against the Famicom and a CD drive peripheral allowed it to fend off the Mega Drive in 1988, though it never really caught on to the same degree outside Japan",['against', 'though']
" The PC Engine eventually lost out to the Super Famicom, but, due to its popular CD add-ons, retained enough of a user base to support new games well into the late 1990s",['but', 'eventually']
"
CD-ROM drives were introduced in this generation, as add-ons for the PC Engine in 1988 and the Mega Drive in 1991",['as']
" Nintendo experimented with optical media formats for the SNES in a joint venture with Sony, who would go on to develop this concept into the PlayStation and rise to prominence as a major competitor to Nintendo and Sega",['as']
" Basic 3D graphics entered the mainstream with flat-shaded polygons enabled by added processors in game cartridges like Virtua Racing and Star Fox, while the Mega Drive managed to produce such graphics without special processors, on the ≈8 MHz 68000 chip by using highly simplified polygon models, a slow frame rate (<4 fps), and reduced resolution",['while']
" The reason for this was that it contained the same hardware that was found in SNK's arcade games",['that']
" This was the first time since the home Pong machines that a true-to-the-arcade experience could be had at home, but the system was commercially inviable",['that', 'but']
"
This era also saw a revival of handheld consoles, which were absent in the prior generation",['also']
" The other consoles also had scarce game libraries compared to over one thousand games released for the Game Boy, including best-selling titles Pokémon Red and Blue, and which inspired an entire line of portable machines that continued through the following two generations",['also']
" Arcade games experienced a resurgence in the early-to-mid-1990s, followed by a decline in the late 1990s as home consoles became more common",['as']
"
As arcade games declined, however, the home video game industry matured into a more mainstream form of entertainment in the 1990s, but their video games also became more and more controversial because of their violent nature, especially in games of Mortal Kombat, Night Trap, and Doom, leading to the formation of the Interactive Digital Software Association and their rating games by signing them their ESRB ratings since 1994",['also', 'because', 'as', 'but']
" Examples of this include Mark Hamill's involvement with Wing Commander III, the introduction of QSound with arcade system boards such as Capcom's CP System II, and the high production budgets of titles such as Squaresoft's Final Fantasy VII and Sega's Shenmue",['as']
" Its success led to a wave of other popular fighting games, such as Mortal Kombat and The King of Fighters",['as']
" Sports games such as NBA Jam also briefly became popular in arcades during this period",['also', 'as']
"
However, with the advent of 32- and 64-bit consoles in the mid-1990s, home video game consoles such as the Sega Saturn, PlayStation and Nintendo 64 also became able to produce texture-mapped 3D graphics",['also', 'as']
" Increasing numbers of players would wait for popular arcade games to be ported to consoles rather than pumping coins into arcade kiosks",['rather than']
"[citation needed] To remain relevant, arcade manufacturers such as Sega and Namco continued pushing the boundaries of 3D graphics beyond what was possible in homes",['as']
" Virtua Fighter 3 for the Sega Model 3, for instance, stood out for having real-time 3D graphics approaching the quality of CGI full motion video (FMV) at the time",['for instance']
" After producing the more powerful Hikaru board in 1999 and Naomi 2 in 2000, Sega eventually stopped manufacturing custom arcade system boards, with their subsequent arcade boards being based on either consoles or commercial PC components",['either', 'eventually', '(E|e)(ither).+?(or)']
"
As patronage of arcades declined, many were forced to close down",['as']
" The design team headed by Gunpei Yokoi had also been responsible for the Game & Watch systems",['also']
" Although these systems were more technologically advanced, they were hampered by higher battery consumption and less third-party developer support",['more + [a-z]*ly', 'although']
" While some of the other systems remained in production until the mid-1990s, the Game Boy, and its successive incarnations the Game Boy Pocket, Game Boy Color and Game Boy Advance, would be virtually unchallenged for dominance in the handheld market, until the PlayStation Portable was released in 2004 to compete with Nintendo's successor to the Game Boy line, the Nintendo DS",['while']
" Since the shareware versions were essentially free, the cost only needed to cover the disk and minimal packaging",['since', 'essentially']
" As the increasing size of games in the mid-1990s made them impractical to fit on floppies, and retail publishers and developers began to earnestly mimic the practice, shareware games were replaced by shorter game demos (often only one or two levels), distributed free on CDs with gaming magazines and over the Internet",['as']
" Meanwhile, Alone in the Dark influenced the survival-horror genre with its action-adventure elements",['meanwhile']
" These devoted 3D rendering daughterboards performed a portion of the computations and memory-handling required for more-detailed three-dimensional graphics (mainly texture filtering), allowing for more-detailed graphics than would be possible if the CPU were required to handle both game logic and all the graphical tasks",['if']
" While other games would also make use of it, the FPS would become the main driving force behind the development of new 3D hardware, and the yardstick by which its performance would be measured, usually quantified as the number of frames per second rendered for a given scene in a given game",['while', 'also']
" Other genres also began to offer online play in the late 90s, including real-time strategy games as Age of Empires, the Warcraft and StarCraft series, and turn-based games such as Heroes of Might and Magic",['also', 'as']
" Also in 1993, The 3DO Company released the 3DO Interactive Multiplayer, which, though highly advertised and promoted, failed to catch up to the sales of the Jaguar, due to its high pricetag",['also', 'though']
" Both consoles had very low sales and few quality games, eventually leading to their demise",['eventually']
" The PlayStation quickly outsold all of its competitors mainly on the strength of its available titles, with the exception of the aging Super Nintendo Entertainment System, which still had the support of many major game companies",['still']
"
The Virtual Boy from Nintendo was released in 1995 as one of the first consumer consoles providing 3D depth perception, but did not achieve high sales, largely due to the monochrome display and the lack of third-party support",['but']
" While Parappa, DDR, and other games found a cult following when brought to North America, music games would not gain a wide audience in the market until the next decade with titles like Guitar Hero",['while']
" Also in 1996 Capcom released Resident Evil, the first well known survival horror game",['also']
"[citation needed] The Legend of Zelda: Ocarina of Time (1998) for the Nintendo 64 is one of the most critically acclaimed games of all time, and is still the highest ranked game across all platforms on video game aggregator Metacritic",['most + [a-z]*ly', 'still']
" The title also featured many innovations such as Z-targeting, which has persisted through subsequent Zelda titles on newer consoles and is commonly used in many other franchises today",['also', 'as']
"
Nintendo's choice to continue using ROM cartridges instead of moving to CD-ROMs for the Nintendo 64, unique among the consoles of this period, proved to have negative consequences for the console and for Nintendo's market share",['instead']
" While cartridges had faster access times, were more durable and resistant to unlicensed copying, CDs could hold far more data (650MB, over ten times the capacity of the largest N64 ROM at 64MB) and cost far less to produce, causing many game companies to turn to Nintendo's CD-based competitors",['while']
" Notably, Square, which had released all prior games in its Final Fantasy series for Nintendo consoles, now turned exclusively to the PlayStation; Final Fantasy VII (1997) was a massive success, establishing the popularity of role-playing video games in the west and making the PlayStation the primary console for the genre, taking the crown from Nintendo who had enjoyed it with the SNES and Square's then Nintendo-exclusive Final Fantasy, Secret of Mana and Chrono Trigger titles",['notably']
" Copies of FFVII still command like-new prices of between US$30–$50 on the used market",['still']
" Capcom also largely departed from Nintendo during the N64 days; the next 4 installments of its popular Mega Man 2D platform shooter were released on PlayStation and Saturn",['also']
" The Saturn was moderately successful in Japan but a commercial failure in North America and Europe, leaving Sega outside of the main competition",['but']
" The N64 achieved huge success in North America and Europe, though it never surpassed PlayStation's sales or was as popular in Japan, and began to show a decline in third-party support for Nintendo's home consoles",['though']
"
This generation ended with the discontinuation of the PlayStation (known in its re-engineered form as the "PSOne") in March 2005",['as']
" While there were games prior that had used three dimensional environments, such as Virtua Racing and Star Fox, it was in this era that many game designers began to move traditionally 2D and pseudo-3D genres into full 3D",['while', 'as']
" 3D became the main focus in this period, as was a slow decline of cartridges in favor of CDs, which allowed far greater storage capacity than what formerly possible",['as']
" The N64 was the last major home console to use the cartridge format, although it persists to this day in handheld games on Nintendo and Sony devices using memory cards similar to Secure Digital (SD) cards",['although']
" The most famous example is that of Counter-Strike; released in 1999, it is still one of the most popular online first-person shooter, even though it was created as a mod for Half-Life by two independent programmers",['even though', 'still', 'though']
" Eventually, game designers realized the potential of mods and custom content in general to enhance the value of their games, and so began to encourage its creation",['eventually']
" Some examples of this include Unreal Tournament, which allowed players to import 3dsmax scenes to use as character models, and Maxis' The Sims, for which players could create custom objects",['as']
" As the first console with a built-in modem for Internet support and online play, it was initially successful, but sales and popularity would start to fall",['as', 'but']
" Production for the console would discontinue in most markets by 2002 and it would be Sega's final console before it reorganized its business as a third party game provider only, partnering primarily with its old rival Nintendo",['as']
" While it had the component-video ability of its contemporaries, the GameCube suffered in several ways compared to Sony's PS2",['while']
" As a result, the GameCube had less third-party backing and very few third-party exclusives, mostly from Nintendo-faithful studios such as Rare and the now-defunct Midway Games",['as a result', 'as']
" Cross-platform giants like Capcom, Electronic Arts and Activision released most of their GameCube titles on other consoles as well, while Square Enix released high-demand PS2 exclusives",['while', 'as well']
" Though T- and M-rated titles did exist on the GameCube, almost all GCN games were E-rated and mostly cartoon-style in their art design",['though']
" By the end of the generation, the Xbox had drawn even with the Nintendo GameCube in sales globally, but since nearly all of its sales were in North America, it pushed Nintendo into third place in the American market",['since', 'but']
" It was also yet another set piece in the debate over video game violence and adult content, with advocacy groups decrying the series' glorification of prostitution, the mafia, and violence, including that against first responders such as police and EMS",['against', 'also']
"
Nintendo still dominated the handheld gaming market during this period",['still']
" Finnish cellphone maker Nokia entered the handheld scene with the N-Gage, but it failed to win a significant following",['but']
"
In January 2013, Sony announced that the PlayStation 2 had been discontinued worldwide, ending the sixth generation",['that']
