" Java is also a popular language for mobile phone based games",['also']
"
As games have grown in size and complexity, middleware is becoming increasingly popular within the industry",['as']
" Middleware provides greater and higher level functionality and larger feature sets than the standard lower level APIs such as DirectX and OpenGL, such as skeletal animation",['as']
" In addition to providing more complex technologies, some middleware also makes reasonable attempts to be platform independent, making common conversions from, for example, Microsoft Windows to PS4 much easier",['also', 'for example']
" Essentially, middleware is aimed at cutting out as much of the redundancy in the development cycle as possible (for example, writing new animation systems for each game a studio produces), allowing programmers to focus on new content",['as', 'essentially', 'for example']
"
Other tools are also essential to game developers: 2D and 3D packages (for example Blender, GIMP, Photoshop, Maya or 3D Studio Max) enable programmers to view and modify assets generated by artists or other production personnel",['also', 'for example']
" IDEs with debuggers (such as Visual Studio) make writing code and tracking down bugs a less painful experience",['as']
"The Canadian federal government has been described as the instigator of multiculturalism as an ideology because of its public emphasis on the social importance of immigration",['because']
"The 1960s Royal Commission on Bilingualism and Biculturalism is often referred to as the origin of modern political awareness of multiculturalism",['as']
"Canadians have used the term "multiculturalism" in different ways: descriptively (as a sociological fact), prescriptively (as ideology) or politically (as policy)",['as']
" In the first sense "multiculturalism" is a description of the many different religious traditions and cultural influences that in their unity and coexistence result in a unique Canadian cultural mosaic",['that']
" Canada has experienced different waves of immigration since the nineteenth century, and by the 1980s almost 40 percent of the population were of neither British nor French origins (the two largest groups, and among the oldest)",['(N|n)(either).+?(nor)']
" European immigrants speaking other languages, such as Canadians of German ethnicity and Ukrainian Canadians, were suspect, especially during the First World War when thousands were put in camps because they were citizens of enemy nations",['because', 'as']
" Jewish Canadians were also suspect, especially in Quebec where anti-semitism was a factor and the Catholic Church of Quebec associated Jews with modernism, liberalism, and other unacceptable values",['also']
" While black ex-slave refugees from the United States had been tolerated, racial minorities of African or Asian origin were generally believed "beyond the pale" (not acceptable to most people)",['while']
" Although this mood started to shift dramatically during the Second World War, Japanese Canadians were interned during the overseas conflict and their property confiscated",['although']
" Legislative restrictions on immigration (such as the Continuous journey regulation and Chinese Immigration Act) that had favoured British, American and European immigrants were amended during the 1960s, resulting in an influx of diverse people from Asia, Africa and the Caribbean",['as']
"In the 21st century Canada is often characterised as being "very progressive, diverse, and multicultural"",['as']
" Canada also resettles over one in ten of the world's refugees",['also']
" Approximately 41% of Canadians are of either the first or second-generation",['either', '(E|e)(ither).+?(or)']
" The Canadian public as well as the major political parties support immigration",['as', 'as well']
" As indicated below, over 50 percent of new immigrants admitted in 2017 came from 10 source countries",['as']
" These urban enclaves have served as a home away from home for immigrants to Canada, while providing a unique experience of different cultures for those of long Canadian descent",['while', 'as']
" Professor John Zucchi of McGill University states:
Unlike earlier periods when significant ethnic segregation might imply a lack of integration and therefore be viewed as a social problem, nowadays ethnic concentration in residential areas is a sign of vitality and indicates that multiculturalism as a social policy has been successful, that ethnic groups are retaining their identities if they so wish, and old-world cultures are being preserved at the same time that ethnic groups are being integrated",['that', 'as', 'at the same time', 'therefore']
" In addition these neighbourhoods, like their cultures, add to the definition of a city and point to the fact that integration is a two-way street",['that']
"Lord Tweedsmuir the 15th Governor General of Canada was an early champion of multiculturalism; from his installation speech in 1935 onwards, he maintained in speeches and over the radio recited his ideas that ethnic groups "should retain their individuality and each make its contribution to the national character," and "the strongest nations are those that are made up of different racial elements",['that']
"" Adélard Godbout, while Premier of Quebec in 1943, published an article entitled "Canada: Unity in Diversity" in the Council on Foreign Relations journal discussing the influence of the Francophone population as a whole",['while', 'as']
" The report of the Commission advocated that the Canadian government should recognize Canada as a bilingual and bicultural society and adopt policies to preserve this character",['that', 'as']
" The proposals also failed to satisfy those Francophones in the Province of Quebec who gravitated toward Québécois nationalism",['also']
" Additionally, Canadians of neither English nor French descent (so-called "Third Force" Canadians) advocated that a policy of "multiculturalism" would better reflect the diverse heritage of Canada's peoples",['that', '(N|n)(either).+?(nor)']
"Paul Yuzyk, a Progressive Conservative Senator of Ukrainian descent, referred to Canada as "a multicultural nation" in his influential maiden speech in 1964, creating much national debate, and is remembered for his strong advocacy of the implementation of a multiculturalism policy and Social liberalism",['as']
"On October 8, 1971, the Liberal government of Prime Minister Pierre Elliot Trudeau announced in the House of Commons that, after much deliberation, the policies of bilingualism and multiculturalism would be implemented in Canada",['that']
"Uniformity is neither desirable nor possible in a country the size of Canada",['(N|n)(either).+?(nor)']
" We should not even be able to agree upon the kind of Canadian to choose as a model, let alone persuade most people to emulate it",['as']
" There are few policies potentially more disastrous for Canada than to tell all Canadians that they must be alike",['that']
" There is no such thing as a model or ideal Canadian",['as']
" What the world should be seeking, and what in Canada we must continue to cherish, are not concepts of uniformity but humanvalues: compassion, love, and understanding",['but']
"When the Canadian constitution was patriated by Prime Minister Trudeau in 1982, one of its constituent documents was the Charter of Rights and Freedoms, and section 27 of the Charter stipulates that the rights laid out in the document are to be interpreted in a manner consistent with the spirit of multiculturalism",['that']
" On a practical level, a result of the Multiculturalism Act was that federal funds began to be distributed to ethnic groups to help them preserve their cultures, leading to such projects as the construction of community centres",['that']
" It contains the globe within its borders, and Canadians have learned that their two international languages and their diversity are a comparative advantage and a source of continuing creativity and innovation",['that']
"The 1988 Canadian Multiculturalism Act affirms the policy of the government to ensure that every Canadian receives equal treatment by the government which respects and celebrates diversity",['that']
" The "Act" in general recognizes:
(a) recognize and promote the understanding that multiculturalism reflects the cultural and racial diversity of Canadian society and acknowledges the freedom of all members of Canadian society to preserve, enhance and share their cultural heritage
(b) to recognize and promote the understanding that multiculturalism is a fundamental characteristic of the Canadian heritage and identity and that it provides an invaluable resource in the shaping of Canada's future
In the Multiculturalism Act, the federal government proclaimed the recognition of the diversity of Canadian culture",['that']
" One of the conditions that this revision specified was the amount of ethnic programming needed in order to be awarded the ethnic broadcasting licence",['in order to']
" According to the act, 60% of programming on a channel, whether on the radio or television, has to be considered ethnic in order to be approved for the licence under this policy",['in order to']
"While the territorial governments do not have multiculturalism policies per se, they have human rights acts that prohibit discrimination based on, among other things, race, colour, ancestry, ethnic origin, place of origin, creed or religion",['while']
" Trudeau espoused participatory democracy as a means of making Canada a "Just Society"",['as']
" This piece of legislation was called The Saskatchewan Multiculturalism Act of 1974, but has since been replaced by the new, revised Multiculturalism Act (1997)",['but']
"Quebec differs from the rest of the nine provinces in that its policy focuses on "interculturalism"- rather than multiculturalism, where diversity is strongly encouraged, but only under the notion that it is within the framework that establishes French as the public language",['that', 'as', 'but', 'rather than']
" Immigrant children must attend French language schools; most signage in English-only is banned (but bilingual signage is common in many communities)",['but']
"In 1990, Quebec released a White paper called Lets Build Quebec Together: A Policy Statement on Integration and Immigration which reinforced three main points:
In 2005, Quebec passed legislation to develop the Ministry of Immigration and Cultural Communities, their functions were:
New Brunswick first introduced their multicultural legislation in 1986",['first']
"Newfoundland and Labrador first legislated their Policy on Multiculturalism in 2008",['first']
" Multiculturalism is often cited as one of Canada's significant accomplishments and a key distinguishing element of Canadian identity",['as']
" Emma Ambrose and Cas Mudde examining surveys of Western nations report:
Data confirms that Canada has fostered a much more accepting society for immigrants and their culture than other Western countries",['that']
" For example, Canadians are the most likely to agree with the statement that immigrants make their country a better place to live and that immigrants are good for the economy",['that', 'for example']
" They are also the least likely to say that there are too many immigrants in their country, that immigration has placed too much pressure on public services, and that immigrants have made it more difficult for natives to find a jo",['that', 'also']
"Canadian supporters of multiculturalism promote the idea because they believe that immigrants help society grow culturally, economically and politically",['that', 'because']
" Supporters declare that multiculturalism policies help in bringing together immigrants and minorities in the country and pushes them towards being part of the Canadian society as a whole",['that', 'as']
" Supporters also argue that cultural appreciation of ethnic and religious diversity promotes a greater willingness to tolerate political differences",['that', 'also']
"Andrew Griffith argues that, "89 percent of Canadians believe that foreign-born Canadians are just as likely to be good citizens as those born in Canada",['that', 'as', 'just as']
"But Canadians clearly view multiculturalism in an integrative sense, with an expectation that new arrivals will adopt Canadian values and attitudes",['that', 'but', 'clearly']
"" Griffith adds that, "There are virtually no differences between Canadian-born and foreign-born with respect to agreement to abide by Canadian values (70 and 68 percent, respectively)",['that']
"" Richard Gwyn has suggested that "tolerance" has replaced "loyalty" as the touchstone of Canadian identity",['that']
"Aga Khan the 49th Imam of the Ismaili Muslims described Canada as: "the most successful pluralist society on the face of our globe, without any doubt in my mind",['as']
" That is something unique to Canada",['that is']
" Aga Khan explained that the experience of Canadian governance – its commitment to pluralism and its support for the rich multicultural diversity of its peoples – is something that must be shared and would be of benefit to societies in other parts of the world",['that']
"A 2008 survey by the Association for Canadian Studies of 600 immigrants showed that 81% agreed with the statement; “The rest of the world could learn from Canada's multicultural policy”",['that']
" The Economist ran a cover story in 2016 praising Canada as the most successful multicultural society in the West",['as']
" The Economist argued that Canada's multiculturalism was a source of strength that united the diverse population and by attracting immigrants from around the world was also an engine of economic growth as well",['that', 'also', 'as well']
" In the introduction to an article which presents research showing that "the multiculturalism policy plays a positive role" in "the process of immigrant and minority integration," Citizenship and immigration Canada sums up the critics' position by stating:
Critics argue that multiculturalism promotes ghettoization and balkanization, encouraging members of ethnic groups to look inward, and emphasizing the differences between groups rather than their shared rights or identities as Canadian citizens",['that', 'rather than']
"Canadian Neil Bissoondath in his book Selling Illusions: The Cult of Multiculturalism in Canada, argues that official multiculturalism limits the freedom of minority members, by confining them to cultural and geographic ethnic enclaves ("social ghettos")",['that']
" He also argues that cultures are very complex, and must be transmitted through close family and kin relations",['that', 'also']
" To him, the government view of cultures as being about festivals and cuisine is a crude oversimplification that leads to easy stereotyping",['as']
"According to a study conducted by The University of Victoria, many Canadians do not feel a strong sense of belonging to Canada, or cannot integrate themselves into society as a result of ethnic enclaves",['as a result', 'as']
" Many immigrants to Canada choose to live in ethnic enclaves because it can be much easier than fitting in with mainstream Canadian culture",['because']
" Stoffman points out that many cultural practices (outlawed in Canada), such as allowing dog meat to be served in restaurants and street cockfighting, are simply incompatible with Canadian and Western culture",['that', 'as', 'simply']
" He also raises concern about the number of recent older immigrants who are not being linguistically integrated into Canada (i.e , not learning either English or French)",['also', 'either', '(E|e)(ither).+?(or)']
" He stresses that multiculturalism works better in theory than in practice and Canadians need to be far more assertive about valuing the "national identity of English-speaking Canada"",['that']
" He argues that multiculturalism hurts the Canadian, Québécois, and indigenous cultures, identity, and nationalism projects",['that']
" Furthermore, he argues, it perpetuates conflicts between and within groups",['furthermore']
" Oxford sociologist, Reza Hasmath, argues that the multicultural project in Canada has the potential to hinder substantive equality in the labour market for ethnic minorities",['that']
"Martin Hewson, politics and international studies professor at the University of Regina, argues that in reaction against multiculturalism, , a post-multicultural world history is now appearing",['against', 'that']
" Hewson points to Ricardo Duchesne’s The Uniqueness of Western Civilization (2011) as its leading book and argues, "The main achievement of post-multicultural world history is to have established that there were numerous critical non-economic divergences between Europe and other regions",['that', 'as']
"Ricardo Duchesne, professor at the University of New Brunswick, has argued that multiculturalism, as it is understood in Canada, encourages visible minorities to affirm their ethnic identities, while at the same time demonizing as "racist" any effort by Eurocanadians to affirm their Anglo, Quebecois, or European ethnic identity.
A 2017 Poll found 37% of Canadians said too many refugees were coming to Canada, up from 30% in 2016",['while', 'that', 'at the same time']
" The 2017 poll also asked respondents about their comfort levels around people of different races and religions, a question that was also asked in 2005-06",['also']
" Quebec's policy seeks to promote interculturalism, welcoming people of all origins while insisting that they integrate into Quebec's majority French-speaking society",['while', 'that']
" In 2008, a Consultation Commission on Accommodation Practices Related to Cultural Differences, headed by sociologist Gerard Bouchard and philosopher Charles Taylor, recognized that Quebec is a de facto pluralist society, but that the Canadian multiculturalism model "does not appear well suited to conditions in Quebec"",['that', 'but']
"As part of its policy to promote multiculturalism in Canada the federal government established a Multiculturalism Directorate"",['as']
" Since the 1950s Canadian literature had been dominated by authors of British or French origins with only a few writers being recognized as persons of different cultural backgrounds",['since', 'as']
"Some of the first were Italian-Canadian authors with such books as: Contrasts: Comparative Essays on Italian-Canadian Writing (1985), and The Anthology of Italian-Canadian Writing (1998), both edited by Joseph Pivato",['as']
" He also wrote, Echo: Essays on Other Literatures (1994) and edited the major academic study, Literatures of Lesser Diffusion/ Les litteratures de moindre diffusion (1990)",['also']
" He also wrote the original academic study, Odysseys Home: Mapping African-Canadian Literature (2002)",['also']
" In a direct democracy, the citizens as a whole form a governing body and vote directly on each issue",['as']
" These representatives meet to form a governing body, such as a legislature",['as']
""Rule of the majority" is commonly referred to as democracy",['as']
" It would be next to impossible to obtain the consent of every individual before acting collectively … No rational people could desire and constitute a society that had to dissolve straightaway because the majority was unable to make the final decision and the society was incapable of acting as one body",['because']
" Western democracy, as distinct from that which existed in pre-modern societies, is generally considered to have originated in city-states such as Classical Athens and the Roman Republic, where various schemes and degrees of enfranchisement of the free male population were observed before the form disappeared in the West at the beginning of late antiquity",['as']
"According to American political scientist Larry Diamond, democracy consists of four key elements: a political system for choosing and replacing the government through free and fair elections; the active participation of the people, as citizens, in politics and civic life; protection of the human rights of all citizens; a rule of law, in which the laws and procedures apply equally to all citizens",['equally', 'as']
" While theoretically these definitions are in opposition, in practice the distinction has been blurred historically",['while']
" The political system of Classical Athens, for example, granted democratic citizenship to free men and excluded slaves and women from political participation",['for example']
"Democracy contrasts with forms of government where power is either held by an individual, as in an absolute monarchy, or where power is held by a small number of individuals, as in an oligarchy",['either', '(E|e)(ither).+?(or)']
" Nevertheless, these oppositions, inherited from Greek philosophy, are now ambiguous because contemporary governments have mixed democratic, oligarchic and monarchic elements",['because', 'nevertheless']
"[citation needed] For example, in a representative democracy, every vote has equal weight, no unreasonable restrictions can apply to anyone seeking to become a representative,[according to whom?] and the freedom of its eligible citizens is secured by legitimised rights and liberties which are typically protected by a constitution",['for example']
"One theory holds that democracy requires three fundamental principles: upward control (sovereignty residing at the lowest levels of authority), political equality, and social norms by which individuals and institutions only consider acceptable acts that reflect the first two principles of upward control and political equality",['that']
"The term "democracy" is sometimes used as shorthand for liberal democracy, which is a variant of representative democracy that may include elements such as political pluralism; equality before the law; the right to petition elected officials for redress of grievances; due process; civil liberties; human rights; and elements of civil society outside the government",['as']
"[citation needed] Roger Scruton argues that democracy alone cannot provide personal and political freedom unless the institutions of civil society are also present",['that', 'also']
"In some countries, notably in the United Kingdom which originated the Westminster system, the dominant principle is that of parliamentary sovereignty, while maintaining judicial independence",['while', 'notably']
" In the United States, separation of powers is often cited as a central attribute",['as']
" Though the term "democracy" is typically used in the context of a political state, the principles also are applicable to private organisations",['also', 'though']
"Majority rule is often listed as a characteristic of democracy",['as']
" Hence, democracy allows for political minorities to be oppressed by the "tyranny of the majority" in the absence of legal protections of individual or group rights",['hence']
" In some countries, freedom of political expression, freedom of speech, freedom of the press, and internet democracy are considered important to ensure that voters are well informed, enabling them to vote according to their own interests",['that']
"It has also been suggested that a basic feature of democracy is the capacity of all voters to participate freely and fully in the life of their society",['that', 'also']
" With its emphasis on notions of social contract and the collective will of all the voters, democracy can also be characterised as a form of political collectivism because it is defined as a form of government in which all eligible citizens have an equal say in lawmaking",['also', 'because']
"While representative democracy is sometimes equated with the republican form of government, the term "republic" classically has encompassed both democracies and aristocracies",['while']
" Many democracies are constitutional monarchies, such as the United Kingdom",['as']
"The term "democracy" first appeared in ancient Greek political and philosophical thought in the city-state of Athens during classical antiquity",['first']
" Cleisthenes is referred to as "the father of Athenian democracy",['as']
"Athenian democracy was not only direct in the sense that decisions were made by the assembled people, but also the most direct in the sense that the people through the assembly, boule and courts of law controlled the entire political process and a large proportion of citizens were involved constantly in the public business",['that', 'also', 'but', 'not only']
" Even though the rights of the individual were not secured by the Athenian constitution in the modern sense (the ancient Greeks had no word for "rights"), the Athenians enjoyed their liberties not in opposition to the government but by living in a city that was not subject to another power and by not being subjects themselves to the rule of another person",['even though', 'but', 'though']
"Range voting appeared in Sparta as early as 700 BC",['as']
" Sparta adopted it because of its simplicity, and to prevent any bias voting, buying, or cheating that was predominant in the early democratic elections",['because']
"Even though the Roman Republic contributed significantly to many aspects of democracy, only a minority of Romans were citizens with votes in elections for representatives",['even though', 'though']
" In addition, the Roman Republic was the first government in the western world to have a Republic as a nation-state, although it didn't have much of a democracy",['although']
" Additionally, the Roman model of governance inspired many political thinkers over the centuries, and today's modern representative democracies imitate more the Roman than the Greek models because it was a state in which supreme power was held by the people and their elected representatives, and which had an elected or nominated leader",['because']
" Other cultures, such as the Iroquois Nation in the Americas between around 1450 and 1600 AD also developed a form of democratic society before they came in contact with the Europeans",['also', 'as']
